[
  {
    "id": "507f1f77bcf86cd799439126",
    "slug": "grapplecity-ulster-open-2026",
    "name": "GrappleCity: Ulster Open 2026",
    "description": "Ulster Open grappling event organized by GrappleCity.",
    "organisation": "GrappleCity",
    "country": "Ireland",
    "websiteUrl": "https://grapplecity.smoothcomp.com/en/event/25758",
    "registrationUrl": "https://grapplecity.smoothcomp.com/en/event/25758",
    "logoUrl": "/images/competitions/507f1f77bcf86cd799439126/507f1f77bcf86cd799439126-lg.webp",
    "tags": ["grapplecity", "ulster-open", "grappling"],
    "startDate": "2026-06-28T00:00:00Z",
    "endDate": "2026-06-28T00:00:00Z",
    "isActive": true,
    "createdAt": "2024-01-01T00:00:00Z",
    "createdBy": "seed"
  }
]
