[
  {
    "id": "507f1f77bcf86cd799439124",
    "slug": "kilkenny-juniors-grappling-league-vii-2026",
    "name": "Kilkenny Juniors Grappling League VII",
    "description": "Juniors grappling league event held in Kilkenny.",
    "organisation": "Kilkenny Grappling League",
    "country": "Ireland",
    "websiteUrl": "https://smoothcomp.com/en/event/28532",
    "registrationUrl": "https://smoothcomp.com/en/event/28532",
    "logoUrl": null,
    "tags": [
      "grappling-league",
      "juniors",
      "kids"
    ],
    "startDate": "2026-06-13T00:00:00Z",
    "endDate": "2026-06-13T00:00:00Z",
    "isActive": true,
    "createdAt": "2024-01-01T00:00:00Z",
    "createdBy": "seed"
  }
]
