[
  {
    "id": "507f1f77bcf86cd799439131",
    "slug": "grapplecity-connaught-winter-open-2026",
    "name": "GrappleCity: Connaught Winter Open 2026",
    "description": "Connaught Winter Open grappling event organized by GrappleCity.",
    "organisation": "GrappleCity",
    "country": "Ireland",
    "websiteUrl": "https://grapplecity.smoothcomp.com/en/event/30246",
    "registrationUrl": "https://grapplecity.smoothcomp.com/en/event/30246",
    "logoUrl": "/images/competitions/507f1f77bcf86cd799439131/507f1f77bcf86cd799439131-lg.webp",
    "tags": [
      "grapplecity",
      "connaught-open",
      "winter"
    ],
    "startDate": "2026-12-13T00:00:00Z",
    "endDate": "2026-12-13T00:00:00Z",
    "isActive": true,
    "createdAt": "2024-01-01T00:00:00Z",
    "createdBy": "seed"
  }
]
