[
  {
    "id": "507f1f77bcf86cd799439121",
    "slug": "elite-grappling-ireland-no-gi-summer-open-2026",
    "name": "Elite Grappling Ireland - No Gi Summer Open 2026",
    "description": "No-Gi submission grappling summer open event in Ireland.",
    "organisation": "Elite Grappling",
    "country": "Ireland",
    "websiteUrl": "https://smoothcomp.com/en/event/31278",
    "registrationUrl": "https://smoothcomp.com/en/event/31278",
    "logoUrl": "/images/competitions/507f1f77bcf86cd799439121/507f1f77bcf86cd799439121-lg.webp",
    "tags": [
      "elite-grappling",
      "no-gi",
      "summer-open"
    ],
    "startDate": "2026-08-01T00:00:00Z",
    "endDate": "2026-08-01T00:00:00Z",
    "isActive": true,
    "createdAt": "2024-01-01T00:00:00Z",
    "createdBy": "seed"
  }
]
