[
  {
    "id": "acce77000000000000000003",
    "slug": "shannonside-bjj-championship",
    "name": "Shannonside BJJ Championship",
    "description": "Regional gi championship along the Shannon.",
    "organisation": "Shannonside Grappling",
    "country": "Ireland",
    "websiteUrl": "https://shannonside-grappling.example.ie/championship",
    "registrationUrl": "https://shannonside-grappling.example.ie/championship/register",
    "tags": ["gi", "championship"],
    "startDate": "now+1d",
    "endDate": "now+3d",
    "isActive": true,
    "createdBy": "acceptance-seed"
  }
]
